{
  "$schema": "../schemas/regions.schema.json",
  "source": "Kementerian Dalam Negeri (Kemendagri): Lampiran Keputusan Menteri Dalam Negeri Nomor 300.2.2-2138 Tahun 2025 tentang Pemberian dan Pemutakhiran Kode, Data Wilayah Administrasi Pemerintahan, dan Pulau, sebagaimana diubah dengan Keputusan Menteri Dalam Negeri Nomor 300.2.2-2430 Tahun 2025 (copies from JDIH BPK, peraturan.bpk.go.id/Details/322942 and /Details/322912)",
  "version": "Kepmendagri 300.2.2-2138/2025 as amended by 300.2.2-2430/2025",
  "complete": true,
  "notes": "All 38 provinces and all 514 kabupaten/kota (416 kabupaten, 98 kota), extracted from Lampiran B of Kepmendagri 300.2.2-2138/2025 and checked against the per-province counts in its Lampiran A and in the Lampiran A of the 300.2.2-2430/2025 amendment, which changes island data only. Names are as printed in the annex. Kecamatan are in data/districts.json.",
  "provinces": [
    {
      "code": "11",
      "name": "Aceh",
      "regenciesComplete": true
    },
    {
      "code": "12",
      "name": "Sumatera Utara",
      "regenciesComplete": true
    },
    {
      "code": "13",
      "name": "Sumatera Barat",
      "regenciesComplete": true
    },
    {
      "code": "14",
      "name": "Riau",
      "regenciesComplete": true
    },
    {
      "code": "15",
      "name": "Jambi",
      "regenciesComplete": true
    },
    {
      "code": "16",
      "name": "Sumatera Selatan",
      "regenciesComplete": true
    },
    {
      "code": "17",
      "name": "Bengkulu",
      "regenciesComplete": true
    },
    {
      "code": "18",
      "name": "Lampung",
      "regenciesComplete": true
    },
    {
      "code": "19",
      "name": "Kepulauan Bangka Belitung",
      "regenciesComplete": true
    },
    {
      "code": "21",
      "name": "Kepulauan Riau",
      "regenciesComplete": true
    },
    {
      "code": "31",
      "name": "Daerah Khusus Ibukota Jakarta",
      "regenciesComplete": true
    },
    {
      "code": "32",
      "name": "Jawa Barat",
      "regenciesComplete": true
    },
    {
      "code": "33",
      "name": "Jawa Tengah",
      "regenciesComplete": true
    },
    {
      "code": "34",
      "name": "Daerah Istimewa Yogyakarta",
      "regenciesComplete": true
    },
    {
      "code": "35",
      "name": "Jawa Timur",
      "regenciesComplete": true
    },
    {
      "code": "36",
      "name": "Banten",
      "regenciesComplete": true
    },
    {
      "code": "51",
      "name": "Bali",
      "regenciesComplete": true
    },
    {
      "code": "52",
      "name": "Nusa Tenggara Barat",
      "regenciesComplete": true
    },
    {
      "code": "53",
      "name": "Nusa Tenggara Timur",
      "regenciesComplete": true
    },
    {
      "code": "61",
      "name": "Kalimantan Barat",
      "regenciesComplete": true
    },
    {
      "code": "62",
      "name": "Kalimantan Tengah",
      "regenciesComplete": true
    },
    {
      "code": "63",
      "name": "Kalimantan Selatan",
      "regenciesComplete": true
    },
    {
      "code": "64",
      "name": "Kalimantan Timur",
      "regenciesComplete": true
    },
    {
      "code": "65",
      "name": "Kalimantan Utara",
      "regenciesComplete": true
    },
    {
      "code": "71",
      "name": "Sulawesi Utara",
      "regenciesComplete": true
    },
    {
      "code": "72",
      "name": "Sulawesi Tengah",
      "regenciesComplete": true
    },
    {
      "code": "73",
      "name": "Sulawesi Selatan",
      "regenciesComplete": true
    },
    {
      "code": "74",
      "name": "Sulawesi Tenggara",
      "regenciesComplete": true
    },
    {
      "code": "75",
      "name": "Gorontalo",
      "regenciesComplete": true
    },
    {
      "code": "76",
      "name": "Sulawesi Barat",
      "regenciesComplete": true
    },
    {
      "code": "81",
      "name": "Maluku",
      "regenciesComplete": true
    },
    {
      "code": "82",
      "name": "Maluku Utara",
      "regenciesComplete": true
    },
    {
      "code": "91",
      "name": "Papua",
      "regenciesComplete": true
    },
    {
      "code": "92",
      "name": "Papua Barat",
      "regenciesComplete": true
    },
    {
      "code": "93",
      "name": "Papua Selatan",
      "regenciesComplete": true
    },
    {
      "code": "94",
      "name": "Papua Tengah",
      "regenciesComplete": true
    },
    {
      "code": "95",
      "name": "Papua Pegunungan",
      "regenciesComplete": true
    },
    {
      "code": "96",
      "name": "Papua Barat Daya",
      "regenciesComplete": true
    }
  ],
  "regencies": [
    {
      "code": "11.01",
      "provinceCode": "11",
      "type": "kabupaten",
      "name": "Kabupaten Aceh Selatan"
    },
    {
      "code": "11.02",
      "provinceCode": "11",
      "type": "kabupaten",
      "name": "Kabupaten Aceh Tenggara"
    },
    {
      "code": "11.03",
      "provinceCode": "11",
      "type": "kabupaten",
      "name": "Kabupaten Aceh Timur"
    },
    {
      "code": "11.04",
      "provinceCode": "11",
      "type": "kabupaten",
      "name": "Kabupaten Aceh Tengah"
    },
    {
      "code": "11.05",
      "provinceCode": "11",
      "type": "kabupaten",
      "name": "Kabupaten Aceh Barat"
    },
    {
      "code": "11.06",
      "provinceCode": "11",
      "type": "kabupaten",
      "name": "Kabupaten Aceh Besar"
    },
    {
      "code": "11.07",
      "provinceCode": "11",
      "type": "kabupaten",
      "name": "Kabupaten Pidie"
    },
    {
      "code": "11.08",
      "provinceCode": "11",
      "type": "kabupaten",
      "name": "Kabupaten Aceh Utara"
    },
    {
      "code": "11.09",
      "provinceCode": "11",
      "type": "kabupaten",
      "name": "Kabupaten Simeulue"
    },
    {
      "code": "11.10",
      "provinceCode": "11",
      "type": "kabupaten",
      "name": "Kabupaten Aceh Singkil"
    },
    {
      "code": "11.11",
      "provinceCode": "11",
      "type": "kabupaten",
      "name": "Kabupaten Bireuen"
    },
    {
      "code": "11.12",
      "provinceCode": "11",
      "type": "kabupaten",
      "name": "Kabupaten Aceh Barat Daya"
    },
    {
      "code": "11.13",
      "provinceCode": "11",
      "type": "kabupaten",
      "name": "Kabupaten Gayo Lues"
    },
    {
      "code": "11.14",
      "provinceCode": "11",
      "type": "kabupaten",
      "name": "Kabupaten Aceh Jaya"
    },
    {
      "code": "11.15",
      "provinceCode": "11",
      "type": "kabupaten",
      "name": "Kabupaten Nagan Raya"
    },
    {
      "code": "11.16",
      "provinceCode": "11",
      "type": "kabupaten",
      "name": "Kabupaten Aceh Tamiang"
    },
    {
      "code": "11.17",
      "provinceCode": "11",
      "type": "kabupaten",
      "name": "Kabupaten Bener Meriah"
    },
    {
      "code": "11.18",
      "provinceCode": "11",
      "type": "kabupaten",
      "name": "Kabupaten Pidie Jaya"
    },
    {
      "code": "11.71",
      "provinceCode": "11",
      "type": "kota",
      "name": "Kota Banda Aceh"
    },
    {
      "code": "11.72",
      "provinceCode": "11",
      "type": "kota",
      "name": "Kota Sabang"
    },
    {
      "code": "11.73",
      "provinceCode": "11",
      "type": "kota",
      "name": "Kota Lhokseumawe"
    },
    {
      "code": "11.74",
      "provinceCode": "11",
      "type": "kota",
      "name": "Kota Langsa"
    },
    {
      "code": "11.75",
      "provinceCode": "11",
      "type": "kota",
      "name": "Kota Subulussalam"
    },
    {
      "code": "12.01",
      "provinceCode": "12",
      "type": "kabupaten",
      "name": "Kabupaten Tapanuli Tengah"
    },
    {
      "code": "12.02",
      "provinceCode": "12",
      "type": "kabupaten",
      "name": "Kabupaten Tapanuli Utara"
    },
    {
      "code": "12.03",
      "provinceCode": "12",
      "type": "kabupaten",
      "name": "Kabupaten Tapanuli Selatan"
    },
    {
      "code": "12.04",
      "provinceCode": "12",
      "type": "kabupaten",
      "name": "Kabupaten Nias"
    },
    {
      "code": "12.05",
      "provinceCode": "12",
      "type": "kabupaten",
      "name": "Kabupaten Langkat"
    },
    {
      "code": "12.06",
      "provinceCode": "12",
      "type": "kabupaten",
      "name": "Kabupaten Karo"
    },
    {
      "code": "12.07",
      "provinceCode": "12",
      "type": "kabupaten",
      "name": "Kabupaten Deli Serdang"
    },
    {
      "code": "12.08",
      "provinceCode": "12",
      "type": "kabupaten",
      "name": "Kabupaten Simalungun"
    },
    {
      "code": "12.09",
      "provinceCode": "12",
      "type": "kabupaten",
      "name": "Kabupaten Asahan"
    },
    {
      "code": "12.10",
      "provinceCode": "12",
      "type": "kabupaten",
      "name": "Kabupaten Labuhanbatu"
    },
    {
      "code": "12.11",
      "provinceCode": "12",
      "type": "kabupaten",
      "name": "Kabupaten Dairi"
    },
    {
      "code": "12.12",
      "provinceCode": "12",
      "type": "kabupaten",
      "name": "Kabupaten Toba"
    },
    {
      "code": "12.13",
      "provinceCode": "12",
      "type": "kabupaten",
      "name": "Kabupaten Mandailing Natal"
    },
    {
      "code": "12.14",
      "provinceCode": "12",
      "type": "kabupaten",
      "name": "Kabupaten Nias Selatan"
    },
    {
      "code": "12.15",
      "provinceCode": "12",
      "type": "kabupaten",
      "name": "Kabupaten Pakpak Bharat"
    },
    {
      "code": "12.16",
      "provinceCode": "12",
      "type": "kabupaten",
      "name": "Kabupaten Humbang Hasundutan"
    },
    {
      "code": "12.17",
      "provinceCode": "12",
      "type": "kabupaten",
      "name": "Kabupaten Samosir"
    },
    {
      "code": "12.18",
      "provinceCode": "12",
      "type": "kabupaten",
      "name": "Kabupaten Serdang Bedagai"
    },
    {
      "code": "12.19",
      "provinceCode": "12",
      "type": "kabupaten",
      "name": "Kabupaten Batu Bara"
    },
    {
      "code": "12.20",
      "provinceCode": "12",